title,description,image_path
Timeless Men's Business Casual Ensemble,A sophisticated blend of comfort and professionalism featuring a tailored blazer paired with premium denim. Perfect for modern professionals who value style and versatility.,1.jpeg
Rolex Day-Date 40mm Masterpiece,Exquisite rose gold timepiece with chocolate diamond dial - the epitome of luxury watchmaking. A statement piece that combines traditional craftsmanship with modern elegance.,2.jpeg
Modern UI Gradient Collection,Sleek professional gradient transition from deep navy #233A4E to sophisticated grey #9C9DB0. Perfect for modern web applications and mobile interfaces.,3.jpeg
Contemporary Ribbed Maxi Dress,Figure-flattering brown maxi dress with long sleeves. Elegant ribbed texture adds sophistication to this versatile piece.,4.jpeg
Old Money Summer Aesthetic,Refined summer look combining classic preppy elements with modern sophistication. Light linens and neutral tones create an effortlessly elegant appearance.,5.jpeg
Oversized Island Vibes Shirt,Relaxed-fit textured button-up in black featuring a modern oversized cut. Perfect for both beach days and urban styling.,6.jpeg
Metropolitan Men's Street Style,Urban sophistication meets casual comfort in this carefully curated ensemble.,7.jpeg
Luxury Garage Dreams,Contemporary garage space showcasing a high-end automobile in an architecturally stunning setting. Perfect blend of luxury and functionality.,8.jpeg
Classic Plaid Wool Pencil Skirt,Timeless high-waisted design in premium wool featuring a sophisticated plaid pattern. Perfect for professional wardrobes.,9.jpeg
Power Dressing: Legal Edition,Contemporary take on professional attire for female lawyers. Combines authority with modern fashion sensibilities.,10.jpeg
Autumn Layering Essentials,Cozy yet stylish fall outfit combining warm textures and rich seasonal colors.,11.jpeg
Earth's Azure Beauty,Breathtaking satellite view of our blue planet showcasing the majestic swirls of clouds over oceans and continents.,12.jpeg
Street-Smart Menswear,Contemporary urban fashion featuring bold silhouettes and modern cuts from Fashion Nova's men's collection.,13.jpeg
Modern Gentleman's Cut,Precision-crafted men's haircut combining classic techniques with contemporary styling.,14.jpeg
DAZY Summer Coordinates,Fresh and casual two-piece set featuring modern typography and relaxed fit. Perfect for warm-weather style.,15.jpeg
Luxe Winter Outerwear,Premium long coat in rich brown tones - the perfect blend of warmth and sophistication for winter wardrobes.,16.jpeg
Elegant Women's Power Suite,Refined professional attire that embodies confidence and sophistication. Perfect for executive meetings and formal occasions.,17.jpeg
Fresh Fade Perfection,Contemporary teen haircut featuring a precisely executed low taper fade with textured top.,18.jpeg
Serene Ocean Horizons,Tranquil seascape capturing the mesmerizing blue hues of the ocean meeting the horizon.,19.jpeg
Warm Sunset Gradient,Rich color transition from golden #F5CB8C to deep brown #7E5936 - perfect for luxury brand applications.,20.jpeg
Modern Minimalist Haven,Contemporary home design showcasing clean lines and natural light with sophisticated architectural elements.,21.jpeg
Textured Crop Fade,Modern men's haircut combining textured styling with precise fade work.,22.jpeg
Architectural Masterpiece,Breathtaking luxury residence featuring innovative design elements and premium materials.,23.jpeg
iPhone 16 Lifestyle,Sleek product photography showcasing the rumored iPhone 16 in a minimalist setting.,24.jpeg
Corporate Chic Collection,Sophisticated office wear inspiration for the modern professional woman with old money aesthetic.,25.jpeg
Urban Rainy Day Aesthetics,Cozy apartment view during rainfall capturing the peaceful ambiance of city living.,26.jpeg
Classic Fade Perfection,Timeless men's haircut with precise fade technique and styled top.,27.jpeg
Apple iPhone 15 Showcase,Latest iPhone model featuring cutting-edge design and premium finish.,28.jpeg
Smart Casual Done Right,Effortlessly stylish men's outfit perfect for various casual occasions.,29.jpeg